{
  "lesson": {
    "id": "P01-welcome-setup-meet-the-guitar-parts",
    "title": "Practice: Welcome & Setup — Meet the guitar & parts",
    "level": "beginner",
    "lesson_type": "technique",
    "one_line_promise": "Rehearse fundamentals until it is automatic.",
    "objectives": [
      "Run a 1-minute change count on the pairs in scope",
      "Hit 30 clean changes/min (advance) and aim for 60 (goal)",
      "Let the app remember your weak pairs for spaced review"
    ],
    "estimated_minutes": 6,
    "practice_of": [
      "L01-welcome-setup-meet-the-guitar-parts"
    ],
    "engine": "one-minute-changes",
    "chords_in_scope": [],
    "pair": [
      []
    ],
    "prerequisites": [],
    "app_feature_mapping": {
      "free_metronome": [
        "drill tempo"
      ]
    }
  },
  "chords": {
    "_schema": "strings ordered low E (6) to high e (1). frets: null = muted/not played, 0 = open. fingers: 0 = open, 1 = index, 2 = middle, 3 = ring, 4 = pinky, null = muted."
  },
  "exercises": [
    {
      "id": "EX1-menu",
      "name": "Warm-up: spider + Chord-Perfect",
      "purpose": "Warm the hand, then lock the target voicings accuracy-first.",
      "params": {
        "drill": "spider-then-chord-perfect",
        "chords": []
      },
      "coaching": "Spider up and down the neck to warm up. Then Chord-Perfect each chord in scope — string by string, no buzz.",
      "qa_status": "verified-by-theory-check-2026-08-08"
    }
  ],
  "avatar_coaching_copy": {
    "intro": "Today we drill what Group 1 taught — clean, even reps, not fast messy ones.",
    "results": "A higher count than last time means your hands are learning. That is the only metric that matters here.",
    "wrap": "Logged to your fluency memory. If a pair is weak, it will resurface in review."
  },
  "qa_block": {
    "must_verify": [
      "Automated: practice lesson passes schema/validateLesson.",
      "Curriculum §5.1: chords_in_scope == cumulative chord set through Group 1 (teaching chord set + everything before).",
      "Pairing: practice_of == teaching lesson L01 (1:1).",
      "Engine: one-minute-changes 30/60 counter wired; weak-pair fluency recorded."
    ],
    "flagged_by": "founder (non-player) — cannot self-verify",
    "verifier_role": "arithmetic (chord-theory-check.js) + schema validate + §5.1 correspondence",
    "guitarist_signoff": "NOT REQUIRED — chord fingerings verified deterministically by chord-theory-check.js."
  }
}