{
  "lesson": {
    "id": "PS23-song-style-money",
    "title": "Practice: Song-style: Money",
    "level": "beginner",
    "lesson_type": "technique",
    "category": "song",
    "one_line_promise": "Drill the Em / G / D loop until automatic.",
    "objectives": [
      "Run 1-minute change counts on every adjacent pair in the loop",
      "Hit 30 clean changes/min, aim 60",
      "Weak pairs resurface in review"
    ],
    "estimated_minutes": 8,
    "practice_of": [
      "S23-money"
    ],
    "engine": "one-minute-changes",
    "chords_in_scope": [
      "Em",
      "G",
      "D"
    ],
    "pair": [
      [
        "Em",
        "G"
      ]
    ],
    "prerequisites": [],
    "app_feature_mapping": {
      "free_metronome": [
        "drill tempo"
      ]
    }
  },
  "chords": {
    "_schema": "strings ordered low E (6) to high e (1). frets: null = muted/not played, 0 = open. fingers: 0 = open, 1 = index, 2 = middle, 3 = ring, 4 = pinky, null = muted.",
    "Em": {
      "qa_status": "verified-by-theory-check-2026-08-08",
      "name": "E minor",
      "frets": [
        0,
        2,
        2,
        0,
        0,
        0
      ],
      "fingers": [
        0,
        2,
        3,
        0,
        0,
        0
      ],
      "note": "Verified deterministically by chord-theory-check.js (2026-08-08) as E B G."
    },
    "G": {
      "qa_status": "verified-by-theory-check-2026-08-08",
      "name": "G major",
      "frets": [
        3,
        2,
        0,
        0,
        0,
        3
      ],
      "fingers": [
        2,
        1,
        0,
        0,
        0,
        3
      ],
      "note": "Verified deterministically by chord-theory-check.js (2026-08-08) as G B D."
    },
    "D": {
      "qa_status": "verified-by-theory-check-2026-08-08",
      "name": "D major",
      "frets": [
        null,
        null,
        0,
        2,
        3,
        2
      ],
      "fingers": [
        null,
        null,
        0,
        1,
        3,
        2
      ],
      "note": "Verified deterministically by chord-theory-check.js (2026-08-08) as D A F#."
    }
  },
  "exercises": [
    {
      "id": "EX1-menu",
      "name": "Warm-up: spider + Chord-Perfect",
      "purpose": "Warm the hand, lock each voicing.",
      "params": {
        "drill": "spider-then-chord-perfect",
        "chords": [
          "Em",
          "G",
          "D"
        ]
      },
      "coaching": "Spider to warm up, then Chord-Perfect each chord in the loop.",
      "qa_status": "verified-by-theory-check-2026-08-08"
    },
    {
      "id": "EX2-1min-Em-G",
      "name": "1-minute changes — Em <-> G",
      "practice_type": "one-minute-changes",
      "purpose": "Count Em <-> G in 60s.",
      "params": {
        "chord_pair": [
          "Em",
          "G"
        ],
        "duration_sec": 60,
        "measure": "count completed changes",
        "canon_key": "Em::G",
        "target_per_min": 30,
        "goal_per_min": 60
      },
      "coaching": "Em to G, back and forth, as many clean changes as you can in a minute.",
      "qa_status": "verified-by-theory-check-2026-08-08"
    },
    {
      "id": "EX2-1min-G-D",
      "name": "1-minute changes — G <-> D",
      "practice_type": "one-minute-changes",
      "purpose": "Count G <-> D in 60s.",
      "params": {
        "chord_pair": [
          "G",
          "D"
        ],
        "duration_sec": 60,
        "measure": "count completed changes",
        "canon_key": "D::G",
        "target_per_min": 30,
        "goal_per_min": 60
      },
      "coaching": "G to D, back and forth, as many clean changes as you can in a minute.",
      "qa_status": "verified-by-theory-check-2026-08-08"
    },
    {
      "id": "EX2-1min-D-Em",
      "name": "1-minute changes — D <-> Em",
      "practice_type": "one-minute-changes",
      "purpose": "Count D <-> Em in 60s.",
      "params": {
        "chord_pair": [
          "D",
          "Em"
        ],
        "duration_sec": 60,
        "measure": "count completed changes",
        "canon_key": "D::Em",
        "target_per_min": 30,
        "goal_per_min": 60
      },
      "coaching": "D to Em, back and forth, as many clean changes as you can in a minute.",
      "qa_status": "verified-by-theory-check-2026-08-08"
    }
  ],
  "avatar_coaching_copy": {
    "intro": "Drill the loop behind \"Money\".",
    "results": "Higher count than last time = learning.",
    "wrap": "Logged to fluency memory."
  },
  "qa_block": {
    "must_verify": [
      "schema validate",
      "1:1 pairing (practice_of)",
      "chords_in_scope == loop chords"
    ],
    "flagged_by": "founder",
    "verifier_role": "arithmetic + schema",
    "guitarist_signoff": "NOT REQUIRED"
  }
}